{
  "id": "qlora-unsloth-local",
  "category": "fine_tuning",
  "tags": ["qlora", "unsloth"],
  "difficulty": "advanced",
  "last_reviewed": "2026-06-08",
  "locales": {
    "en": {
      "title": "QLoRA local with Unsloth / TRL",
      "summary": "Reference hyperparameters and workflow for parameter-efficient fine-tuning on a consumer GPU.",
      "steps_md": "## Goal\n\nFine-tune a 7B-class model on one GPU with QLoRA.\n\n## Reference hyperparameters\n\n| Parameter | Starting value |\n|-----------|----------------|\n| rank (r) | 16 (32–64 for large domain shift) |\n| lora_alpha | 2× rank (e.g. 32) |\n| learning_rate | 1e-4 – 2e-4 |\n| epochs | 1–3 |\n| lora_dropout | 0.05–0.1 |\n| target_modules | all linear layers |\n\n## Steps\n\n1. Prepare dataset (see **LoRA dataset prep** recipe).\n2. Install Unsloth or TRL + PEFT in a venv.\n3. Train with 4-bit base model (QLoRA).\n4. Evaluate on held-out set + general capability smoke tests.\n5. Merge adapter or export GGUF → deploy via Ollama (see export recipe).\n\n## Run via Akasha\n\nAsk the agent to run training with `run_command` in an allowed venv — not from the UI directly."
    },
    "fr": {
      "title": "QLoRA local avec Unsloth / TRL",
      "summary": "Hyperparamètres de référence et workflow pour fine-tuning efficient sur GPU grand public.",
      "steps_md": "## Objectif\n\nFine-tuner un modèle ~7B sur un GPU avec QLoRA.\n\n## Hyperparamètres de référence\n\n| Paramètre | Valeur de départ |\n|-----------|------------------|\n| rank (r) | 16 (32–64 si gros décalage domaine) |\n| lora_alpha | 2× rank (ex. 32) |\n| learning_rate | 1e-4 – 2e-4 |\n| epochs | 1–3 |\n| lora_dropout | 0,05–0,1 |\n| target_modules | toutes les couches linéaires |\n\n## Étapes\n\n1. Préparer le dataset (recette **Préparation dataset LoRA**).\n2. Installer Unsloth ou TRL + PEFT dans un venv.\n3. Entraîner avec modèle base 4-bit (QLoRA).\n4. Évaluer sur jeu hold-out + tests capacités générales.\n5. Fusionner l'adapter ou exporter GGUF → Ollama (recette export).\n\n## Via Akasha\n\nDemander à l'agent d'exécuter l'entraînement via `run_command` dans un venv autorisé."
    }
  },
  "prerequisites": {
    "min_ram_gb": 16,
    "gpu_hint": "nvidia",
    "models_hint": ["gguf", "instruct"]
  },
  "commands": [
    {
      "label_en": "Install Unsloth (example)",
      "label_fr": "Installer Unsloth (exemple)",
      "command": "pip install unsloth"
    },
    {
      "label_en": "TRL SFT with PEFT LoRA (outline)",
      "label_fr": "SFT TRL avec PEFT LoRA (schéma)",
      "command": "trl sft --model_name meta-llama/Llama-3.2-3B-Instruct --dataset_path train.jsonl --output_dir ./lora-out --peft lora"
    }
  ],
  "actions": [
    { "type": "open_models_tab", "label_en": "Pick base model", "label_fr": "Choisir modèle de base" }
  ],
  "related_recipe_ids": ["lora-dataset-prep", "export-ollama-gguf"],
  "external_links": [
    {
      "label_en": "Gemma cookbook — LoRA tuning",
      "label_fr": "Gemma cookbook — LoRA tuning",
      "url": "https://github.com/google-gemma/cookbook/blob/main/docs/core/lora_tuning.ipynb"
    },
    {
      "label_en": "Unsloth docs",
      "label_fr": "Documentation Unsloth",
      "url": "https://docs.unsloth.ai/"
    }
  ]
}
